2019-07-06 , 07:35:15,2019-07-06 07:35:1562398500,DV,https://www.facebook.com/1954072204870360/posts/2385192925091617/,Congress Leader Nitish Kumar Assaults Engineer,Former Maharashtra CM के बेटे Nitesh Rane ने govt officer पर फेंका कीचड़,Politics,Politics*,,,Judiciary & Crime,Politics*,,,"Violence, Famous Personality","Crime, Famous Personality",Controversial,,Controversial,text only (to),famous personality (fp),,relevant,,,,Commoner,Action,,,no tags
2019-07-05 , 13:35:15,2019-07-05 13:35:1562333700,AG,https://www.facebook.com/1954072204870360/posts/2384452655165644/,220 Kids Of The Separatists Community in Kashmir Have Settled Abroad,Kashmir को फूंकने वाले अलगाववादी नेताओं के बच्चे विदेशों में हैं settle,Politics,Foreign Affairs,,,Global News,Daily NEWJ*,,,Facts,Facts,Controversial,,Controversial,text only (to),Crowd,,relevant,,,,Crowd,"Anger, Action",,,no tags
2019-07-04 , 15:35:15,2019-07-04 15:35:1562254500,AK,https://www.facebook.com/1954072204870360/posts/2383820348562208/,Indian Economy Becomes One Of The Fastest Growing Economies Of The World,दुनिया की fastest growing economies में से एक है Indian economy,Business & Money,Foreign Affairs,,,Global News,Achievements,,,"Economy/Economic, Award/Achievement","Economy/Economic, Award/Achievement",Informative,,General ,text only (to),other,Building,low,,,,Famous Personality,Action,Nirmala Sitaraman,Politics,no tags
2019-07-04 , 14:35:15,2019-07-04 14:35:1562250900,HR,https://www.facebook.com/1954072204870360/posts/2383852855225624/,Party Workers' Plea To Rahul Gandhi To Take Back Congress Presidency,Rahul के इस्तीफे को वापस लेने की मांग पर अड़े party workers,Politics,Politics*,,,Politics,Daily NEWJ*,,,"Famous Personality, Protests/Rallies, News","Famous Personality, Protests/Rallies, News",Informative,,Informative, common voice (optv),commoner (np),,no music,,,,Famous Personality,Happy ,Rahul Gandhi ,Politics,no tags
2019-07-13 , 06:35:15,2019-07-13 06:35:1562999700,VA,https://www.facebook.com/1954072204870360/posts/2388972234713686/,Bengaluru Man On A Mission To Clean The City,Bengaluru के Anirudh ने लिया cleaning को लेकर initiative,Environment,Environment,,,Environment/Ecosystem,People,,,"Social Work, Conservation, Person Specific","Social Work, Conservation, Person Specific",Inspiring,,Inspiring,text only (to),commoner (np),,relevant,,,,Commoner,Happy ,,,no tags
2019-08-25 , 05:05:15,2019-08-25 05:05:1566709500,VA,https://www.facebook.com/1954072204870360/posts/2421421874802055/,"Dr Sunil Kumar Hebbi, Bengaluru Doctor, Provides Free Treatment To The Underprivileged",देखिए कैसे Dr Sunil Kumar कर रहे हैं poor और needy people की help,X Do not use People,Health,,,Lifestyle,Health,,,"Social Work, Famous Personality, Health","Social Work, Famous Personality, Health",Inspiring,,Inspiring,text only (to),commoner (np),,relevant,,,,Commoner,Happy ,,,"Hospital, poor, needy, Bengaluru, doctor, Medical Care"
2019-07-09 , 11:35:15,2019-07-09 11:35:1562672100,AG,https://www.facebook.com/1954072204870360/posts/2387611991516377/,Indian Leg-Spin Sensation: Yuzi Chahal,सिर्फ 3 साल में ये player बन गया team India की ताकत,Sports & Games,Sports & Games,,,Sports & Games,People,,,"Cricket, Famous Personality","Cricket, Famous Personality",Profile,,Profile,text only (to),famous personality (fp),,loud,,,,Famous Personality,Happy ,Yuzi Chahal,Sport,no tags
2019-07-05 , 02:35:15,2019-07-05 02:35:1562294100,DV,https://www.facebook.com/1954072204870360/posts/2383672271910349/,Indian Air Force Lose Over 40 Aircrafts In The Past 5 Years. Reports Of 46 Casualties,पिछले पांच सालों में Indian Air Force ने खोए 44 aircrafts और helicopters,Garv,Police-Army,,,Forces,Daily NEWJ*,,,"Air Force, Crisis","Air Force, Crisis",Shocking/Surprising,,Concerning,text only (to),other,Airplane,relevant,,,,Building/ Factory,Neutral ,,,no tags
2019-07-05 , 06:35:15,2019-07-05 06:35:1562308500,AK,https://www.facebook.com/1954072204870360/posts/2383799071897669/,Congress Reigns In Non-Gandhi Presidency,क्या एक बार फिर non-Gandhi Congress President  बनने के बाद आएंगे Congress के अच्छे दिन,Politics,Politics*,,,Politics,History,,,History,History,Compilation,,Compilation,text only (to),other,Court,low,,,,Famous Personality,Neutral ,Sonia Gandhi ,Politics,no tags
2019-07-06 , 02:35:15,2019-07-06 02:35:1562380500,DV,https://www.facebook.com/1954072204870360/posts/2384441568500086/,Dr Shyama Prasad Mukherjee: The Founder Of Jansangh,Article 370 के सख्त खिलाफ थे Dr Shyama Prasad Mukherjee और इसीलिए उन्होंने छोड़ी Congress Party,Politics,Politics*,,,Politics,People,,,"Famous Personality, Anniversary",Famous Personality,Day-specific,,"Day-specific, Profile",text only (to),famous personality (fp),,relevant,,,,Famous Personality,Neutral ,Shyama Prasad Mukherjee,Politics,no tags
2019-07-04 , 13:35:15,2019-07-04 13:35:1562247300,VA,https://www.facebook.com/1954072204870360/posts/2383783448565898/,Rahul Gandhi's Journey As The Congress President,डेढ़ साल में Rahul Gandhi ने क्या खोया क्या पाया?,Politics,Politics*,,,Politics,People,,,Famous Personality,Famous Personality,Profile,,Profile,text only (to),famous personality (fp),,neutral,,,,Famous Personality,Neutral ,Rahul Gandhi,Politics,no tags
2019-07-03 , 11:02:15,2019-07-03 11:02:1562151777,DK,https://www.facebook.com/1954072204870360/posts/2383059275304982/,Rahul Gandhi Officially Resigns As The Congress President,"BREAKING NEWJ | Rahul Gandhi ने दिया इस्तीफा, Twitter पर डाला resignation letter",Politics,Politics*,,,Politics,Daily NEWJ*,,,"Famous Personality, News","Famous Personality, News",Informative,,Informative,other,famous personality (fp),,loud,,,,Famous Personality,Neutral ,Rahul Gandhi,Politics,no tags
2019-07-03 , 08:15:15,2019-07-03 08:15:1562141716,DK,https://www.facebook.com/1954072204870360/posts/2382975751980001/,Cricketer Ambati Rayudu Retires From All Formats Of Cricket,BREAKING NEWJ | Ambati Rayudu ने Cricket को कहा अलविदा,Sports & Games,Sports & Games,,,Sports & Games,Daily NEWJ*,,,"Famous Personality, News, Cricket","Famous Personality, News, Cricket",Informative,,Informative,other,famous personality (fp),,loud,,,,Famous Personality,Action,Ambati Rayudu,Sport,no tags
2019-07-08 , 03:35:15,2019-07-08 03:35:1562556900,VA,https://www.facebook.com/1954072204870360/posts/2384579335152976/,Rural Women Of Satara Started Community Radio,"10 साल पहले 12 महिलाओं ने शुरू किया था community radio, आज हैं पूरे Maharashtra की महिलाओं के लिए आदर्श",Social Work,Lifestyle,,,Business,Business & Money,,,"Empowerment, Small Business",Empowerment,Inspiring,,Inspiring, common voice (optv),commoner (np),,no music,,,,Commoner,Happy ,,,no tags
2019-07-14 , 06:35:15,2019-07-14 06:35:1563086100,DV,https://www.facebook.com/1954072204870360/posts/2388993944711515/,"Karnataka Man's Diet Consists Of Rocks, Bricks And Mud Only","20 साल से खा रहा है Pakkirappa ईंट, पत्थर और मिट्टी",Lifestyle,Lifestyle,,,Weird News,Food,,,"Person Specific,Food","Person Specific,Food",Shocking/Surprising,,Shocking/Surprising,text only (to),commoner (np),,relevant,,,,Commoner,Action,,,no tags
2019-07-05 , 04:35:15,2019-07-05 04:35:1562301300,DV,https://www.facebook.com/1954072204870360/posts/2383673121910264/,Bengaluru Man Digs 1 Lakh Recharge Wells,"Vishwanath को  ""Water Man"" के नाम से क्यों बुलाते हैं लोग?",Environment,Environment,,,Environment/Ecosystem,People,,,"Social Work, Conservation, Social Work","Social Work, Conservation, Social Work",Inspiring,,Inspiring, common voice (optv),commoner (np),,relevant,,,,Commoner,Action,,,no tags
2019-07-04 , 07:35:15,2019-07-04 07:35:1562225700,AK,https://www.facebook.com/1954072204870360/posts/2383543111923265/,Mahua Moitra Faces Plagiarism Charge Over Her Revolutionary Speech,American media से चुराई है Mahua Moitra ने अपनी क्रांतिकारी speech,Politics,Politics*,,,Politics,Viral,,,"Statement/Speech, Famous Personality","Statement/Speech, Famous Personality",Inspiring,,Inspiring,text only (to),other,Court,loud,,,,Famous Personality,Action,Mahua Moitra,Politics,no tags
2019-07-08 , 06:35:15,2019-07-08 06:35:1562567700,HR,https://www.facebook.com/1954072204870360/posts/2385387101738866/,"Nava Bharat Night School, A Ray Of Hope For Underprivileged Sections","Mangaluru के इस night school में पढ़ते हैं auto rickshaw drivers, waiters और daily wage workers",Education,Education,,,Education,Education,,,"Educational Institute, Facilities",Empowerment,Informative,,Informative,text only (to),other,Building,relevant,,,,Commoner,Action,,,no tags
2019-07-05 , 05:35:15,2019-07-05 05:35:1562304900,HR,https://www.facebook.com/1954072204870360/posts/2383627401914836/,The Reason Behind Mumbai Floods,क्यों होती है Mumbai बार बार बाढ़ का शिकार?,Environment,Environment,,,Environment/Ecosystem,Environment,,,Calamity,Crisis,Explainers,,"Explainers, Shocking/Surprising",text only (to),other,Building,neutral,,,,Object,Action,,,no tags
2019-07-04 , 04:35:15,2019-07-04 04:35:1562214900,AK,https://www.facebook.com/1954072204870360/posts/2383045748639668/,India Independence Act Of 1947 That Led To India's Partition,India Independence Act जिसके बाद दो हिस्सों में बंटे थे India और Pakistan,Undefined,Government,,,Government,History,,,"Laws, History","Judicial, History",Explainers,,Explainers,text only (to),famous personality (fp),,relevant,,,,Famous Personality,Neutral ,J N Neharu,Politics,no tags
2019-07-03 , 15:35:15,2019-07-03 15:35:1562168100,DV,https://www.facebook.com/1954072204870360/posts/2382951391982437/,"Unclaimed Amount Of ₹32,000 Crore Lays In Banks","Banks में लावारिस पड़े हैं आम लोगों के ₹32,000 crore",Business & Money,Business & Money,,,Business,Daily NEWJ*,,,News,News,Shocking/Surprising,,Shocking/Surprising,text only (to),commoner (np),,relevant,,,,Commoner,Action,,,no tags
2019-07-02 , 15:35:15,2019-07-02 15:35:1562081700,DK,https://www.facebook.com/1954072204870360/posts/2382279172049659/,"In Mumbai, Heaviest Rain In 24 Hours In A Decade","Mumbai पर बारिश का प्रहार, हर जगह मचा हाहाकार",Environment,Environment,,,Environment/Ecosystem,Daily NEWJ*,,,Calamity,"Crisis, News",Shocking/Surprising,,Shocking/Surprising,other,Crowd,,low,,,,Commoner,Action,,,no tags
2019-07-07 , 11:35:15,2019-07-07 11:35:1562499300,VA,https://www.facebook.com/1954072204870360/posts/2384606711816905/,A Device That Aids The Blind To Identify Fake Notes,Blind लोगों के लिए fake notes को पकड़ने के लिए बनाया गया है ये device,Science & Tech,Science & Tech*,,,Technology & Innovations,Daily NEWJ*,,,"Invention, Differently Abled",Person Specific,Informative,,"Inspiring, Informative",text only (to),other,Shirt,relevant,,,,Commoner,Action,,,no tags
2019-07-05 , 03:35:15,2019-07-05 03:35:1562297700,HR,https://www.facebook.com/1954072204870360/posts/2383715518572691/,"""Puducherry: The Mini France  Of India""",Puducherry जाकर France जाने की ख्वाहिश को कर सकते हैं पूरा,Travel,Travel,,,Places,Place,,,Tourism,Tourism,Informative,,Informative,text only (to),other,Road,relevant,,,,Building/ Factory,Neutral ,,,no tags
2019-07-03 , 05:35:15,2019-07-03 05:35:1562132100,RG,https://www.facebook.com/1954072204870360/posts/2382286698715573/,Family Robbed At Gunpoint By Three Masked Miscreants,"घर में घुसकर gun point पर family के साथ loot, CCTV में record हुआ पूरा incident",Crime,Crime,,,Judiciary & Crime,Crime,,,"Crime, Violence",Crime,Shocking/Surprising,,Shocking/Surprising,other,commoner (np),,relevant,,,,Object,Neutral ,,,no tags
2019-07-01 , 09:11:15,2019-07-01 09:11:1561972287,DK,https://www.facebook.com/1954072204870360/posts/2381448515466058/,"Vijay Shankar Out Of World Cup, Mayank Agarwal To Replace Him","BREAKING NEWJ | Dhawan के बाद team India को दूसरा झटका, Vijay Shankar हुए World Cup से बाहर",Sports & Games,Sports & Games,Sports & Games,Sports & Games,Sports & Games,Daily NEWJ*,,,"Cricket, News","Cricket, News",Informative,,Informative,text only (to),famous personality (fp),,loud,,,,Famous Personality,Anger,Vijay Shankar,Sport,no tags
2019-07-03 , 02:35:15,2019-07-03 02:35:1562121300,HR,https://www.facebook.com/1954072204870360/posts/2382299332047643/,The Man Who Climb Trees Upside Down,5 minute में 70ft तक की उंचाई वाले पेड़ पर उलटे होकर चढ़ जाते हैं Mukesh Kumar,Inventions / Innovations,Art,,,Skill & Art ,People,,,"X-Factor, Person Specific","X-Factor, Person Specific",Shocking/Surprising,,Shocking/Surprising,text only (to),commoner (np),,relevant,,,,Commoner,Action,,,no tags
2019-07-03 , 03:35:15,2019-07-03 03:35:1562124900,HR,https://www.facebook.com/1954072204870360/posts/2382277745383135/,The Untold Story : Mahendra Singh Dhoni,देखिए Dhoni का Football से Cricket तक का सफर,Sports & Games,Sports & Games,,,Sports & Games,People,,,"Cricket, Famous Personality","Cricket, Famous Personality",Profile,,Profile,text only (to),famous personality (fp),,neutral,,,,Famous Personality,Action,M S Dhoni ,Sport,no tags
2019-07-02 , 06:35:15,2019-07-02 06:35:1562049300,DK,https://www.facebook.com/1954072204870360/posts/2382126005398309/,The Shimla Agreement Of 1972,क्या था Shimla Agreement  जिसे लेकर India Pakistan के बीच आज भी है विवाद,Government,Government,,,Government,History,,,"Court Ruling, History","Judicial, History",Explainers,,Explainers,other,famous personality (fp),,relevant,,,,Famous Personality,Action,Indira gandhi ,Politics,no tags
2019-07-01 , 14:35:15,2019-07-01 14:35:1561991700,DV,https://www.facebook.com/1954072204870360/posts/2381620895448820/,"Dangal Star Zaira Wasim Quits Films, States Religion As Her Reason",Dangal girl Zaira Wasim ने  Islam  के लिए छोड़ी acting,Filmy,Filmy*,,,Entertainment,Daily NEWJ*,,,"Famous Personality, News","Famous Personality, News",Shocking/Surprising,,Shocking/Surprising,text only (to),famous personality (fp),,relevant,,,,Famous Personality,Action,Zaira Wasim,film,no tags
2019-07-07 , 04:35:15,2019-07-07 04:35:1562474100,HR,https://www.facebook.com/1954072204870360/posts/2384605278483715/,India's Biggest Weaving Centre,देखिए कैसे बनती है handloom साड़ी?,Culture,Culture,,,Places,Place,,,Culture,Culture,Informative,,General ,text only (to),commoner (np),,low,,,,Commoner,Action,,,no tags
2019-07-01 , 13:35:15,2019-07-01 13:35:1561988100,VA,https://www.facebook.com/1954072204870360/posts/2381538552123721/,Rain Floods The Viewers Gallery At Statue Of Unity,₹3000 crore में बने Statue Of Unity की viewers gallery में भरा पानी,Daily NEWJ,Environment,,,Environment/Ecosystem,Viral,,,"Calamity, News","Crisis, News",Trending,,"Trending, Viral",text only (to),other,wall,low,,,,Object,Neutral ,,,no tags
2019-07-02 , 04:35:15,2019-07-02 04:35:1562042100,VA,https://www.facebook.com/1954072204870360/posts/2381622162115360/,Forest Range Officer Attacked In Telangana,देखिए किस तरह mob ने लाठियों से मारा महिला officer को,Crime,Crime,,,Judiciary & Crime,Crime,,,Violence,Crime,Shocking/Surprising,,Shocking/Surprising,text only (to),Crowd,,low,,,,Crowd,"Anger, Action",,,no tags
2019-07-01 , 10:39:15,2019-07-01 10:39:1561977583,SA,https://www.facebook.com/1954072204870360/posts/2381503785460531/,#WorldCup2019: India Vs Bangladesh,कल World Cup में एक बार फिर भिड़ेंगे India Bangladesh,Sports & Games,Sports & Games,Sports & Games,Sports & Games,Sports & Games,Event,,,Cricket,Cricket,Informative,,"Event, Informative",text only (to),famous personality (fp),,loud,,,,Famous Personality,Action,Indian cricket team ,Sport,no tags
2019-07-03 , 04:35:15,2019-07-03 04:35:1562128500,HP,https://www.facebook.com/1954072204870360/posts/2382213318722911/,Viral Video : Herd Of Elephants Attack Cars in Uttarakhand,Video देख आप हो जाएंगे shock!,Animals ,Undefined,,,Weird News,Viral,,,Animals,Animals,Shocking/Surprising,,"Shocking/Surprising, Viral",other,other,Elephants,no music,,,,Animal,Action,,,no tags
2019-06-30 , 04:35:15,2019-06-30 04:35:1561869300,DV,https://www.facebook.com/1954072204870360/posts/2380007148943528/,Dalai Lama's Word Of Advice To Refugees,"Europe बन जाएगी Muslim country, जानें क्यों कही Dalai Lama ने ये बात",Foreign Affairs,Foreign Affairs,,,Global News,People,,,"Famous Personality, Philosophy, Statement/Speech","Famous Personality, Spiritual, Statement/Speech",Informative,,General , voice of famous personality (fpv),famous personality (fp),,no music,,,,Famous Personality,Neutral ,DalaiLama,Spirituality,no tags
2019-06-29 , 12:35:15,2019-06-29 12:35:1561811700,SA,https://www.facebook.com/1954072204870360/posts/2379949568949286/,"Bird Collides With Fighter Jet Jaguar, Pilot Averts Accident","Ambala Air Base पर टला बड़ा accident, fighter jet के take off के दौरान टकराई bird",Undefined,Undefined,,,Others,Animals,,,"Animals, News","Animals, News, Air Force",Informative,,General ,other,other,Airplane,relevant,,,,Object,Action,,,no tags
2019-06-29 , 14:35:15,2019-06-29 14:35:1561818900,VA,https://www.facebook.com/1954072204870360/posts/2379943515616558/,Indian Railways Opens Up 50% Reservation For Women,"Indian Railway में women को मिलेगा 50% reservation, 9,000 से ज्यादा vacant posts पर जल्द start होगी recruitment",Government,Government,,,Government,Daily NEWJ*,,,"Policies/Norms/Rules, Railways",Policies/Norms/Rules,Informative,,Informative,text only (to),commoner (np),,relevant,,,,Commoner,Happy ,,,no tags
2019-06-29 , 10:35:15,2019-06-29 10:35:1561804500,SA,https://www.facebook.com/1954072204870360/posts/2379879478956295/,#WorldCup2019: India Vs England,क्या England को घर पर मात दे पाएगी team India?,Sports & Games,Sports & Games,,,Sports & Games,Event,,,Cricket,Cricket,Informative,,"Informative, Event",text only (to),famous personality (fp),,relevant,,,,Commoner,"Happy, Action",,,no tags
2019-06-28 , 11:07:15,2019-06-28 11:07:1561720078,DK,https://www.facebook.com/1954072204870360/posts/2379244532353123/,"Jawaharlal Nehru Responsible For Giving Part Of Kashmir To Pakistan, says Amit Shah",BREAKING NEWJ | Home Minister Amit Shah ने Kashmir समस्या के लिए Jawaharlal Nehru को ठहराया जिम्मेदार,Politics,Politics*,,,Politics,Daily NEWJ*,,,"Famous Personality, Statement/Speech","Famous Personality, Statement/Speech",Controversial,,"Informative, Controversial",text only (to),famous personality (fp),,loud,,,,Famous Personality,Action,Amit Shah,Politics,no tags
2019-06-28 , 12:35:15,2019-06-28 12:35:1561725300,DK,https://www.facebook.com/1954072204870360/posts/2379228239021419/,"AIMIM Member's Threats Of Rape, Violence To Seek ‘Revenge’",AIMIM के members ने दी 34 women को rape की धमकी,Crime,Politics*,,,Politics,Crime,,,Statement/Speech,Statement/Speech,Controversial,,"Shocking/Surprising, Controversial",text only (to),other,Banner,relevant,,,,Object,Neutral ,,,no tags
2019-07-01 , 04:35:15,2019-07-01 04:35:1561955700,DK,https://www.facebook.com/1954072204870360/posts/2380067052270871/,International Joke Day,International Joke Day पर सुनिए इन हास्य कवियों को,X Do not use Bollywood & Entertainment,Filmy*,,,Entertainment,Undefined,,,Comedy,Facts,Compilation,,"Funny, Compilation, Day-specific", common voice (optv),commoner (np),,no music,,,,Commoner,Happy ,,,no tags
2019-06-29 , 07:35:15,2019-06-29 07:35:1561793700,DV,https://www.facebook.com/1954072204870360/posts/2379858982291678/,Academy That Teaches Women To Pack A Punch,Pune में 500 से अधिक women करती हैं bouncer बनने  की training,Lifestyle,Lifestyle,,,Others,Lifestyle,,,"Educational Institute, Empowerment",Empowerment,Informative,,General ,text only (to),commoner (np),,relevant,,,,Commoner,Happy ,,,no tags
2019-07-01 , 11:35:15,2019-07-01 11:35:1561980900,DK,https://www.facebook.com/1954072204870360/posts/2381516028792640/,History Of Indian Budget Through Ages,Budget बनाने के लिए क्या होती है खास तैयारियां,Business & Money,Government,,,Government,Economy,,,"Budget, History","Economy/Economic, Facts, History",Informative,,"Explainers, Informative",text only (to),famous personality (fp),,low,,,,Commoner,Happy ,Arun Jaitley,Politics,no tags
2019-06-28 , 13:35:15,2019-06-28 13:35:1561728931,DK,https://www.facebook.com/1954072204870360/posts/2379335312344045/,Air India: The Downfall Of A Giant,बुलंदियों को छूने के बाद कैसे डूब गई Air India,X Do not use History,Business & Money,,,Business,Economy,,,"History, Economy/Economic","History, Economy/Economic",Informative,,Informative,text only (to),other,Airplane,relevant,,,,Commoner,Happy ,,,no tags
2019-06-29 , 09:13:15,2019-06-29 09:13:1561799633,HR,https://www.facebook.com/1954072204870360/posts/2379920192285557/,India's Famous Art Form That Talks About Social Issues,इस painting को सामाजिक मुद्दों पर जागरूकता पैदा करने के लिए use करते हैं लोग,Art,Art,,,Skill & Art ,Culture,,,"Painting, Culture","Visual Arts, Culture",Informative,,Informative,text only (to),other,Banner,low,,,,Object,Neutral ,,,no tags
2019-07-15 , 03:35:15,2019-07-15 03:35:1563161700,SN,https://www.facebook.com/1954072204870360/posts/2389824357961807/,The Mystery Of Nanda Devi's Nuclear Device,Nanda Devi - पहाड़ों में छुपा विस्फोटक खतरा,X Do not use History,Undefined,,,Global News,History,,,"History, Facts","History, Facts",Shocking/Surprising,,Shocking/Surprising,voice over (vo),other,Flag,relevant,,,,Nature,Neutral ,,,no tags
2019-06-29 , 05:35:15,2019-06-29 05:35:1561786500,DV,https://www.facebook.com/1954072204870360/posts/2379801975630712/,"Changes In 3 Bank Rules, Applicable from 1st July, Much To Customers Relief",Banks के 1st July से change हो जाएंगे ये 3 rules,Business & Money,Government,,,Government,Economy,,,"Policies/Norms/Rules, Economy/Economic","Policies/Norms/Rules, Economy/Economic",Informative,,Informative,text only (to),commoner (np),,low,,,,Commoner,Action,,,no tags
2019-07-02 , 05:35:15,2019-07-02 05:35:1562045700,AG,https://www.facebook.com/1954072204870360/posts/2381639458780297/,The Unusual Instruments Of 'Dharavi Rocks' Band,कचरे से musical instruments बना कर Dharavi का ये band कर रहा है rock,Animals ,Art,,,Skill & Art ,Entertainment,,,"X-Factor, Music","X-Factor, Music",Entertaining,,"Entertaining, Shocking/Surprising",text only (to),commoner (np),,relevant,,,,Commoner,Happy ,,,no tags
2019-07-02 , 00:35:15,2019-07-02 00:35:1562027700,HR,https://www.facebook.com/1954072204870360/posts/2381572585453651/,The Tradition Of Pandharpur Wari,Pandharpur wari भगवान Vitthal के दर्शन के लिए वो परंपरा जो हजारों साल से है जिंदा,Dharohar,Dharohar*,,,Lifestyle,Culture,,,"Culture, Religion, Religious Place","Culture, Religion",Informative,,Informative,text only (to),Crowd,,relevant,,,,Crowd,Neutral ,,,not editable
2019-07-07 , 00:35:15,2019-07-07 00:35:1562459741,GL,https://www.facebook.com/1954072204870360/posts/2385250915085818/,The Story Of Africa's Siddis Settled In India,ये है Africa से भारत आए Siddis की कहानी,Dharohar,Lifestyle,,,Lifestyle,Culture,,,"Culture, History","Culture, History",Informative,,Informative,text only (to),other,Nature,relevant,,,,Commoner,Neutral ,,,no tags
2019-06-27 , 07:30:15,2019-06-27 07:30:1561620630,DK,https://www.facebook.com/1954072204870360/posts/2378372019107041/,"Nirav Modi's Bank Accounts Seized In Switzerland, 60 Lakh Dollars Confiscated","BREAKING NEWJ | Nirav Modi की बढ़ी मुश्किल, 4 Swiss bank account में रखे ₹283.16 crore हुए seize",Business & Money,Crime,,,Judiciary & Crime,Daily NEWJ*,,,"Business, Economy/Economic, Famous Personality","Economy/Economic, Famous Personality",Controversial,,Controversial,text only (to),famous personality (fp),,loud,,,,Famous Personality,Neutral ,Nirav Modi,business,no tags
