2019-10-31 , 02:30:15,2019-10-31 02:30:1572489000,VA,https://www.facebook.com/1954072204870360/posts/2478763142401261/,"Longwa, Where The Villagers Have Dual Citizenship","हमारे देश के इस गांव के लोगों के पास है दो देशों की नागरिकता, गांव के बीच से होकर निकलती है दो देशों की सीमा रेखा",Travel,Travel,,,Places,Place,,,Policies/Norms/Rules,Policies/Norms/Rules,Informative,,"Shocking/Surprising, Informative",text only (to),other,Nature,relevant,,,,Other,Neutral ,,,"Nagaland, Myanmar, Burmese Cuisine, Longwa Village, Konyak Tribe, India-Myanmar Border, Burma, Tribal"
2019-10-23 , 02:30:15,2019-10-23 02:30:1571797800,HG,https://www.facebook.com/1954072204870360/posts/2471240386486870/,Kabir Yatra: Rajasthan's Musical Sojourn,"कबीर यात्रा जो है राजस्थान का एक यात्रा संगीत उत्सव, क्या होता है इस यात्रा में खास?",Culture,Culture,,,Lifestyle,Culture,,,"Music, Culture","Music, Culture",Informative,,Informative,other,commoner (np),,relevant,,,,Crowd,"Happy, Action",,,"Rajasthan, Folk Music, Rajasthan kabir Yatra, Kabir Yatra, Musical Festival, Indian Folk music, Sant Kabir, Kabir Yatra Concert"
2019-10-27 , 11:05:15,2019-10-27 11:05:1572174300,AK,https://www.facebook.com/1954072204870360/posts/2471355786475330/,China-Made Lights Taking A Toll On Local Diya Business,"चाइनीज लाइटों के कारण फीकी होती जा रही है दियों की चमक, कुम्हार परिवारों पर पड़ रहा है बुरा असर",Business & Money,Business & Money,,,Business,Daily NEWJ*,,,Economy/Economic,Economy/Economic,Informative,,General ,text only (to),other,lamp,loud,,,,Object,Neutral ,,,"Diwali, Diwali Festival, Handmade diyas, Handmade lamps, Earthen Lamps, Chinese Diwali Lights, Indian Festivals, Deepavali"
2019-10-23 , 15:05:15,2019-10-23 15:05:1571843100,VA,https://www.facebook.com/1954072204870360/posts/2471570813120494/,Process Of Vote Tally,किस तरह होती है आप के मूल्यवान वोट की गिनती?,Education,Government,,,Government,Daily NEWJ*,,,Elections,"News, facts",Explainers,,Explainers,text only (to),other,Voting Machine,relevant,,,,Crowd,"Anger, Action",,,"Voting Counting Process, Matganna, Election process, Voting Counting, Ballot, EVM"
2019-10-20 , 11:05:15,2019-10-20 11:05:1571569500,DG,https://www.facebook.com/1954072204870360/posts/2469361533341422/,Indian Army Launches Attack On POK Terror Camps,पीओके में भारतीय सेना ने उड़ाए आतंक के ठिकाने,X Do not use Armed Forces,Police-Army,,,Forces,Police-Army,,,"Army, News","Army, News",Informative,,General ,text only (to),Crowd,,relevant,,,,Object,Neutral ,,,"Terrorism, Jammu and Kashmir, Pakistan, Indian Army attack, Indian Army, POK terror camps, Cross border terrorism, Artillery firing"
2019-10-20 , 15:35:15,2019-10-20 15:35:1571585700,DG,https://www.facebook.com/1954072204870360/posts/2469367266674182/,Beginners' Guide To Exercise Your Voting Rights,महाराष्ट्र और हरियाणा में विधानसभा चुनावों में वोट डालने से पहले यें बाते जानना है बेहद जरुरी,Education,Government,,,Government,Government,,,Elections,Facts,Explainers,,Explainers,text only (to),other,Voting machine,relevant,,,,Object,Neutral ,,,"Haryana Vidhan Sabha Elections, Maharashtra Vidhan Sabha Elections, Voting, Elections, Indian elections, NOTA, EVM Machines, State Assembly Elections"
2019-10-31 , 04:30:15,2019-10-31 04:30:1572496239,AK,https://www.facebook.com/1954072204870360/posts/2478976239046618/,Remembering Former PM Indira Gandhi,"इंदिरा गांधी - गूंगी गुड़िया से आयरन लेडी बनने का सफर

(via NEWJ Garv)",Politics,Politics*,,,Politics,People,,,Famous Personality,Famous Personality,Profile,,Profile,voice over (vo),famous personality (fp),,no music,,,,Famous Personality,Happy ,Indira Gandhi,Politics,"Amritsar, Punjab, Indira Gandhi Assassination, Indira Gandhi death, Operation Blue Star, Former Prime Minister, Jawaharlal Nehru, Emergency in India, Golden Temple"
2019-12-15 , 05:30:15,2019-12-15 05:30:1576387857,VA,https://www.facebook.com/1954072204870360/posts/2522062694737972/,Tribute To India's Iron Man Sardar Vallabhbhai Patel,"सरदार से लेकर लौह पुरुष तक बनने वाले वल्लभ भाई की पुण्यतिथि पर जानिए उनका सफर       

(via NEWJ Garv)",Politics,Politics*,,,Politics,People,,,Famous Personality,Famous Personality,Profile,Profile,Profile,voice over (vo),famous personality (fp),,relevant,,,,Object,Neutral ,,,"Hyderabad, Sardar Vallabhbhai Patel, Vallabhbhai Patel, Sardar Patel, Iron man of India, Loh purush, Sardar Patel Jayanti, Nizam of Hyderabad"
2019-10-27 , 06:35:15,2019-10-27 06:35:1572158100,AK,https://www.facebook.com/1954072204870360/posts/2473359162941659/,Irfan Pathan - One Of India's Best Swing Bowlers,पाकिस्तान के खिलाफ टेस्ट मैचों में हैट्रीक लेने वाले एकलौते गेंदबाज का आज है जन्मदिन,Sports & Games,Sports & Games,,,Sports & Games,People,,,Famous Personality,"Famous Personality, Cricket",Profile,,Profile,text only (to),famous personality (fp),,loud,,,,Famous Personality,Happy ,Irfan Pathan,Sport,"Test Cricket & First-Class Cricket, Cricket, Pakistan, Vadodara, Gujarat, India, Irfan Pathan, Baroda, Team India, Hattrick"
2019-10-21 , 10:35:15,2019-10-21 10:35:1571654100,DG,https://www.facebook.com/1954072204870360/posts/2470364816574427/,Girls Can Now Take Admission In Sainik Schools,कब से सैनिक स्कूलों में जा पाएंगी लड़कियां?,Education,Education,,,Education,Daily NEWJ*,,,"Educational Institute, News","Empowerment, News",Informative,,Informative,text only (to),Crowd,,relevant,,,,Crowd,Neutral ,,,"Defence Ministry, Military School, Military, Admission, school, education"
2019-10-19 , 11:05:15,2019-10-19 11:05:1571483100,VA,https://www.facebook.com/1954072204870360/posts/2468289310115311/,Hyderabad's First Female Food Delivery Agent,स्विग्गी की पहली महिला फूड डिलीवरी एजेंट,Food,Lifestyle,,,Lifestyle,People,,,"Person Specific, Award/Achievement, Food","Person Specific, Award/Achievement, Food",Informative,,General ,text only (to),other,Mobile phone,loud,,,,Commoner,Happy ,,,"Hyderabad, Janani Rao Swiggy, Janani Rao Delivery Girl, Food delivery girl Janani Rao, Food Delivery App, Swiggy, Women Empowerment"
2019-10-18 , 15:05:15,2019-10-18 15:05:1571411100,VA,https://www.facebook.com/1954072204870360/posts/2467341573543418/,What Makes MS Dhoni The Coolest Head?,"क्या चीज बनाती है महेंद्र सिंह धोनी को 'कैप्टन कूल', धोनी ने बताया अपना सीक्रेट

MS Dhoni",Sports & Games,Sports & Games,,,Sports & Games,People,,,Famous Personality,"Famous Personality, Cricket",Entertaining,,Entertaining,text only (to),famous personality (fp),,relevant,,,,Famous Personality,Happy ,MS Dhoni,Sport,"MS Dhoni, MSD, Mahendra Singh Dhoni, Captain Cool, Thala Dhoni, Team India, Mahi, BCCI"
2019-10-26 , 11:05:15,2019-10-26 11:05:1572087900,AK,https://www.facebook.com/1954072204870360/posts/2473346942942881/,"Manikyam, the World's Shortest Cow","दुनिया की सबसे छोटी गाय, जिसने बनाया गिनीज वर्ल्ड रिकॉर्ड",Animals ,Animals,,,Environment/Ecosystem,Animals,,,"Animals, Facts","Animals, Facts",Informative,,General ,text only (to),commoner (np),,relevant,,,,"Commoner, Animal",Neutral ,,,"Animal Rescue, Animal Welfare, Cattle Ranching & Beef Production, Kerala, Cute Animals, Manikyam Cow, Guiness World Record, Shortest Cow"
2019-10-22 , 04:35:15,2019-10-22 04:35:1571718900,VA,https://www.facebook.com/1954072204870360/posts/2470523506558558/,The Day When ISRO's Chandrayaan-1 Was Launched,"आज ही के दिन 11 साल पहले लॉन्च हुआ था चंद्रयान-1, इस मिशन से देश को क्या हासिल हुई थी उपलब्धि?",Science & Tech,Science & Tech*,,,Government,History,,,"Tech, ISRO, History","History, Science",Informative,,Informative,text only (to),other,Rocket launch vehicle,relevant,,,,Object,Neutral ,,,no tags
2019-10-19 , 15:05:15,2019-10-19 15:05:1571497500,AK,https://www.facebook.com/1954072204870360/posts/2468348343442741/,Xiaomi's Redmi 8A To Be Available In Offline Stores,"कौन सा है वो स्मार्टफोन जिसमें है 5000 एमएएच की बैटरी और कीमत है सिर्फ ₹6,499?",Science & Tech,Science & Tech*,,,Technology & Innovations,Daily NEWJ*,,,"Tech, News",News,Informative,,Informative,text only (to),other,Smart phone,relevant,,,,Object,Neutral ,,,"Xiaomi Redmi 8A, Mi smartphones, Redmi 8A Phone, Smartphone, cellphones, Flipkart, Mi Store, China phones"
2019-10-28 , 11:05:15,2019-10-28 11:05:1572260701,HG,https://www.facebook.com/1954072204870360/posts/2471252979818944/,Mumbai Man Builds An Aircraft On His Terrace,"खुद के पैसों से घर की छत पर बनाया प्लेन, एक बार में 6 लोग कर सकते हैं सफर",Science & Tech,Science & Tech*,,,Technology & Innovations,People,,,"Famous Personality, Innovation",Person Specific,Informative,,General ,text only (to),other,Aircraft,relevant,,,,Commoner,Happy ,,,"Make in India, Mumbai, Maharashtra, Airplane, Homemade plane, Aircraft, Aircraft built on terrace Mumbai"
2019-10-18 , 06:39:15,2019-10-18 06:39:1571380764,SA,https://www.facebook.com/1954072204870360/posts/2467142423563333/,Hyderabad Based Lab Makes Edible Cups,कौन से हैं ये कप्स जिन्हें खाया भी जा सकता है?,Food,Science & Tech*,,,Technology & Innovations,Science & Tech*,,,"Conservation, Innovation, Food","Conservation, Food",Informative,,Informative,text only (to),commoner (np),,relevant,,,,Object,Neutral ,,,"Hyderabad, Biotechnology, Food Science, Genetics & Genomics, Edible Cups, Genomelabs, Hyderabad Genomelabs, Eatable Cups"
2019-10-18 , 11:05:15,2019-10-18 11:05:1571396700,DG,https://www.facebook.com/1954072204870360/posts/2467293290214913/,Ishrat Rashid - Kashmir's First Specially-Abled Basketball Player,"कौन हैं कश्मीर की पहली दिव्यांग बास्केटबॉल खिलाड़ी, जो अंतर्राष्ट्रीय टूर्नामेंट में लेंगी हिस्सा?",Sports & Games,Sports & Games,,,Sports & Games,People,,,"Differently Abled, Basketball, Famous Personality","Other Sports, Famous Personality, X-Factor",Inspiring,,Inspiring, common voice (optv),commoner (np),,relevant,,,,Commoner,Neutral ,,,"Srinagar, Jammu and Kashmir, Wheelchairs, Basketball, Jammu and Kashmir, Ishrat Rashid, Srinagar, Specially-abled Basketball player"
2019-10-20 , 06:35:15,2019-10-20 06:35:1571553300,SU,https://www.facebook.com/1954072204870360/posts/2468240360120206/,J&K's First-Ever Girls Cricket Tournament,जम्मू-कश्मीर में पहली बार लड़कियों के लिए आयोजित किया गया क्रिकेट टूर्नामेंट,Sports & Games,Sports & Games,,,Sports & Games,Event,,,"News, Cricket","News, Cricket",Inspiring,,"General , Event",text only (to),commoner (np),,relevant,,,,Commoner,Action,,,"Srinagar, Jammu and Kashmir, Test Cricket & First-Class Cricket, Cricket, Women's Fitness, Jammu and Kashmir, Rajouri District, Girls Cricket Tournament, Empowerment"
2019-10-18 , 04:30:15,2019-10-18 04:30:1571373000,VA,https://www.facebook.com/1954072204870360/posts/2466375126973396/,Odd-Even Rule To Be Back In Delhi,"दिल्ली में फिर एक बार लागू होगा ऑड-इवन, इस बार नियमों में हुए कई बदलाव

Arvind Kejriwal Manish Sisodia",Travel,Environment,,,Environment/Ecosystem,Daily NEWJ*,,,"Pollution, Policies/Norms/Rules, News","Crisis, Policies/Norms/Rules, News",Informative,,Informative,text only (to),other,Cars,relevant,,,,Object,Neutral ,,,"Aam Admi Party, Delhi, India, Delhi Odd Even Rule, Traffic rules in Delhi, Smog in Delhi, Arvind Kejriwa, AAP Govt in delhi, Odd Even Road Safety rules"
2019-10-17 , 15:35:15,2019-10-17 15:35:1571326500,AK,https://www.facebook.com/1954072204870360/posts/2466473886963520/,What Earned Abhijit Banerjee The Prestigious Nobel Prize?,अभिजीत बनर्जी ने क्या उपाय बताए हैं गरीबी खत्म करने के लिए?,Business & Money,Economy,,,Education,Achievements,,,"Economy/Economic, Award/Achievement","Economy/Economic, Award/Achievement",Informative,,Informative,text only (to),famous personality (fp),,relevant,,,,Famous Personality,Happy ,"Abhijit banerjee , Esther Duflo",Economists,"Child Development, Sustainable Living, Poverty & Income Inequality, Nobel Memorial Prize in Economic Sciences, Kenya, Abhijit Banerjee, Nobel Prize, Developing Nations"
2019-10-22 , 00:35:15,2019-10-22 00:35:1571704508,RG,https://www.facebook.com/1954072204870360/posts/2470490623228513/,Is Lord Hanuman Still Alive ?,"इस कलयुग में किसने देखा हनुमान जी को?

(via NEWJ Dharohar)",Dharohar,Dharohar*,,,Lifestyle,Culture,,,"Religion, Beliefs",Religion,Explainers,,Explainers,voice over (vo),other,Footprint of Hanuman,low,,,,Famous Personality,Happy ,Hanuman,Devotional,"God, Lord Hanuman, Hanuman, Worship, Existence, Kalyug"
2019-10-13 , 06:35:15,2019-10-13 06:35:1570948500,VA,https://www.facebook.com/1954072204870360/posts/2462473800696862/,Journey of Mumbai’s iconic ‘kali peeli’ Padmini taxis ends in June 2020,कब से Mumbai की सड़कों पर नहीं दिखेगी Kali Peeli Padmini Taxi?,X Do not use History,Daily NEWJ*,,,Others,Place,,,"History, News","History, News",Informative,,Informative,text only (to),other,Kali peeli taxi,loud,,,,Object,Neutral ,,,"Mumbai, Maharashtra, Kaali Peeli, Taxi, Padmini, Iconic"
2019-10-19 , 05:30:15,2019-10-19 05:30:1571463000,AK,https://www.facebook.com/1954072204870360/posts/2468113540132888/,Ashok Arora's New Political Journey With Congress,"अशोक अरोड़ा, आईएनएलडी के साथ लंबी राजनीति के बाद थामा कांग्रेस का हाथ",Politics,Politics*,,,Politics,People,,,Famous Personality,Famous Personality,Profile,,Profile, voice of famous personality (fpv),famous personality (fp),,relevant,,,,Famous Personality,Proud,Ashok Arora,Politics,"Haryana, Hisar, Haryana, Indian National Congress, Ashok Arora, INLD, Haryana Elections, INC, Politics"
2019-10-18 , 13:35:15,2019-10-18 13:35:1571405700,DV,https://www.facebook.com/1954072204870360/posts/2467082510235991/,Dhananjay Munde's Political Journey,"धनंजय मुंडे, परिवारवाद के कारण छोड़ा चाचा का साथ, आज हैं एनसीपी के कद्दावर नेता

Dhananjay Munde",Politics,Politics*,,,Politics,People,,,"Famous Personality, Journey",Famous Personality,Profile,,Profile,text only (to),famous personality (fp),,loud,,,,Famous Personality,Action,Dhananjay Munde,Politics,"NCP Leader Dhananjay Munde, Nationalist Congress Party, Maharashtra Elections, BJP, Pankaja Munde, Gopinath Munde, Vidhan Sabha Elections, Politics"
2019-10-21 , 04:30:15,2019-10-21 04:30:1571632200,HR,https://www.facebook.com/1954072204870360/posts/2468332603444315/,About 20000 New Shakhas And 1 Lakh Requests To Join RSS In 2019,पिछले कुछ सालों में आरएसएस की शाखाओं की बढ़ी संख्या,X Do not use People,Social Work,,,Lifestyle,Lifestyle,,,Social Work,Social Work,Informative,,Informative,text only (to),Crowd,,relevant,,,,Crowd,Neutral ,,,"RSS, RSS Sangh, Requests, Joining, Latest"
2019-11-19 , 06:35:15,2019-11-19 06:35:1574145300,SP,https://www.facebook.com/1954072204870360/posts/2497837480493827/,Lord Krishna's Butter Ball That Defies Laws Of Gravity,कैसे ये बटर बॉल सदियों से दे रही है ग्रेविटी के सिद्धांतों को मात?,Animals ,Dharohar*,,,Places,Place,,,Religion,Religion,Informative,,Informative,text only (to),other,butter ball,relevant,,,,Object,Neutral ,,,not editable
2019-10-18 , 05:30:15,2019-10-18 05:30:1571376600,VA,https://www.facebook.com/1954072204870360/posts/2466328986978010/,Haryana's Young Statesman Dushyant Chautala,"28 साल की उम्र में पहली बार ये बने थे सांसद, अब दादा ओमप्रकाश चौटाला की सियासत को दे रहे हैं टक्कर

Dushyant Chautala",Politics,Politics*,,,Politics,People,,,Famous Personality,Famous Personality,Informative,,Informative,text only (to),famous personality (fp),,relevant,,,,Famous Personality,Proud,Dushyant Chautala,Politics,"Dushyant Chautala, Omprakash Chautala, Haryana Elections, Vidhan Sabha Elections, State Assembly elections, Politics, Elections in India"
2019-10-17 , 13:30:15,2019-10-17 13:30:1571319007,DV,https://www.facebook.com/1954072204870360/posts/2466243216986587/,Ashok Chavan - Carrying The Political Legacy,"अशोक चव्हाण, जिन्होंने दो बार संभाला महाराष्ट्र के मुख्यमंत्री का पद 

Ashok Chavan",Politics,Politics*,,,Politics,People,,,Famous Personality,Famous Personality,Informative,,Informative,text only (to),famous personality (fp),,relevant,,,,Famous Personality,Action,Ashok Chavan,Politics,"Nanded, Indian National Congress, Ashok Chavan, Maharashtra Chief Minister, Maharashtra Elections, Vidhan Sabha Elections, Shankarrao Chavan, INC"
2019-10-29 , 04:30:15,2019-10-29 04:30:1572323431,RG,https://www.facebook.com/1954072204870360/posts/2473217589622483/,Historic Story Behind The Occasion Of Bhai Dooj,"क्या है भाई दूज की पौराणिक कथा?

(via NEWJ Dharohar)",Dharohar,Dharohar*,,,Lifestyle,Culture,,,"Religion, Culture","Religion, Culture",Informative,,Informative, common voice (optv),famous personality (fp),,relevant,,,,Commoner,Happy ,,,"Diwali, Bhai dooj, relation, history, occasion, festival"
2019-10-16 , 11:05:15,2019-10-16 11:05:1571223900,DV,https://www.facebook.com/1954072204870360/posts/2465394770404765/,Google Pixel 4 Won't Launch In India,किस वजह से गूगल पिक्सेल 4 स्मार्टफोन्स भारत में नहीं होंगे लॉन्च?,Science & Tech,Science & Tech*,,,Technology & Innovations,Daily NEWJ*,,,News,News,Informative,,Informative,text only (to),other,Smart Phone,relevant,,,,Object,Neutral ,,,"Google Pixel 4 Launch in India, Google Pixel 4 launch, Google Pixel 4, Soli Radar, 6 GHz Frequency, Smartphones, India, Google"
2019-10-19 , 04:30:15,2019-10-19 04:30:1571459400,VA,https://www.facebook.com/1954072204870360/posts/2467202143557361/,Parle's Net Profit Goes Uphill,"10,000 कर्मचारियों को निकालने वाली पार्ले को हुआ था 15% से ज्यादा मुनाफा

Parle-G",Business & Money,Business & Money,,,Business,Economy,,,Economy/Economic,Economy/Economic,Informative,,Informative,text only (to),other,Parle G biscuits,relevant,,,,Object,Neutral ,,,"Labour economics, Business News, Parle G, Parle G biscuits, Economic Slowdown, Financial crisis in India, Parle Biscuit Company, Vile Parle"
2019-10-29 , 11:05:15,2019-10-29 11:05:1572347100,AK,https://www.facebook.com/1954072204870360/posts/2473431329601109/,Gujarat's 75-Year-Old 'Batwoman',कैसे ये महिला अपने घर में करती है 400 से ज्यादा चमगादड़ों की संभाल?,Food,Undefined,,,Weird News,People,,,"Animals, Person Specific
","Animals, Person Specific
",Shocking/Surprising,,Shocking/Surprising,text only (to),other,Bats,relevant,,,,Commoner,Neutral ,,,not editable
2019-10-26 , 02:30:15,2019-10-26 02:30:1572057058,RG,https://www.facebook.com/1954072204870360/posts/2472178403059735/,Reason Why People Donate Diya On Narak Chaturdashi,"क्यों किया जाता है नरक चतुर्दशी के दिन दीपदान?

(via NEWJ Dharohar)",Dharohar,Dharohar*,,,Lifestyle,Lifestyle,,,"Religion, Beliefs",Religion,Informative,,Informative,voice over (vo),other,Firecrackers,relevant,,,,Famous Personality,"Happy, Action",Krishna with gopis,Devotional,"Diwali, narak chaturdashi, occasion, festival, donate"
2019-10-27 , 02:30:15,2019-10-27 02:30:1572143456,RG,https://www.facebook.com/1954072204870360/posts/2474100036200905/,Things To Consider While Doing Pooja This Diwali,"देखिए दिवाली पूजन की विधि व कब है शुभ मुहूर्त

(via NEWJ Dharohar)",Dharohar,Dharohar*,,,Lifestyle,Lifestyle,,,Festival,Culture,Self-help,,Self-help,voice over (vo),other,Firecrackers,relevant,,,,Famous Personality,Happy ,Laxmi Ganesh,Devotional,"Diwali, Folklore & Mythology, Pooja, Festival, Occasion, Rituals, tradition"
2019-10-16 , 13:30:15,2019-10-16 13:30:1571232601,DV,https://www.facebook.com/1954072204870360/posts/2465423230401919/,Ajit Pawar 'Clocking' Ahead Of Time,"6 बार के विधायक और पूर्व उपमुख्यमंत्री अजित पवार बारामती में बचा पाएंगे अपना गढ़?

Ajit Pawar",Politics,Politics*,,,Politics,Politics*,,,Elections,News,Informative,,Informative,text only (to),famous personality (fp),,relevant,,,,Famous Personality,Action,Ajit Pawar,Politics,"Maharashtra, Ajit Pawar, NCP Ajir Pawar, Nationalist Congress Party, Sharad Pawar, Anantrao Pawar, Maharashtra Elections, Baramati"
2019-10-17 , 05:30:15,2019-10-17 05:30:1571290201,AKG,https://www.facebook.com/1954072204870360/posts/2465345983742977/,Haryana Congress Giant Bhupinder Singh Hooda,"हरियाणा के 9वें मुख्यमंत्री और 4 बार के लोकसभा सांसद भूपेंद्र सिंह हुड्डा का राजनीतिक सफर

Bhupinder Singh Hooda",Politics,Politics*,,,Politics,Politics*,,,Elections,News,Informative,,Informative,text only (to),famous personality (fp),,relevant,,,,Famous Personality,Happy ,Bhupinder Singh Hooda,Politics,"Indian National Congress, Bhupinder Singh Hooda, Bhupendra Singh Hooda, Haryana CM, Former CM Haryana, Haryana Vidhan Sabha Elections, Politics, State assembly elections"
2019-10-16 , 02:35:15,2019-10-16 02:35:1571193300,DG,https://www.facebook.com/1954072204870360/posts/2464657107145198/,Abhijit Banerjee Honoured With Nobel Prize,अभिजीत बनर्जी जिन्हें मिलेगा नोबेल पुरस्कार,X Do not use People,Education,,,Global News,People,,,"Award/Achievement, Famous Personality","Award/Achievement, Famous Personality",Informative,,"Profile, Inspiring",text only (to),famous personality (fp),,loud,,,,Famous Personality,Happy ,Abhijit Banerjee,Science & Tech,"Nobel Memorial Prize in Economic Sciences, Abhijit Banerjee, Economics, Economist, Indian, Nobel 2019, India"
2019-10-28 , 06:35:15,2019-10-28 06:35:1572244500,DV,https://www.facebook.com/1954072204870360/posts/2471211103156465/,Reward On Finding Abusers Of A Leopard Cub In Gujarat,"क्यों इस वायरल वीडियो पर गिर वन विभाग ने रखा है ₹25,000 का इनाम?",X Do not use Viral X,Animals,,,Environment/Ecosystem,Daily NEWJ*,,,Animals,Animals,Informative,,Informative,text only (to),other,Leopard,no music,,,,Animal,"Anger, Fear",,,"Wild Cats, Animal Cruelty, Leopard Cub Gujarat, Amreli, Animal Abuse, Wild Animals, Leopard Cub, Reward"
2019-10-15 , 15:05:15,2019-10-15 15:05:1571151900,DG,https://www.facebook.com/1954072204870360/posts/2464648687146040/,Section 144 To Restrict Diwali Celebrations In Ayodhya,धारा 144 के बीच राम जन्म भूमि अयोध्या में लोग कैसे चला पाएंगे पटाखे?,Dharohar,Dharohar*,,,Judiciary & Crime,Government,,,"Laws, Festival","Judicial, Religion, Policies/Norms/Rules",Informative,,Informative,text only (to),other,"Nature, Temple",relevant,,,,Temple,Neutral ,,,"Diwali, Ayodhya, Celebrations, Festival, India, Section 144, Restrictions"
