2019-08-26 , 14:35:15,2019-08-26 14:35:1566830100,AK,https://www.facebook.com/1954072204870360/posts/2423929567884619/,6 Islamic Nations Honoured PM Modi With Highest Civilian Awards,"PM Modi बने muslim countries की पसंद, 5 सालों में muslim countries से PM Modi को मिले 6 awards",Foreign Affairs,Foreign Affairs,,,Global News,Politics*,,,"Famous Personality, Political, Award/Achievement","Famous Personality, Award/Achievement",Informative,,Informative,text only (to),famous personality (fp),,relevant,,,,Famous Personality,"Happy, Proud",Narendra Modi,Devotional,"Narendra Modi, Order of Zayed, Muslim Countries, UAE, Gulf Countries"
2019-09-14 , 16:05:15,2019-09-14 16:05:1568477103,VA,https://www.facebook.com/1954072204870360/posts/2436507053293537/,What Sets Kutch's Kharai Camels Apart From The Other Breeds?,क्या है Kharai camel breed की खासियत जिसे जरूरत है conservation की?,Animals ,Animals,,,Environment/Ecosystem,Animals,,,Animals,Animals,Informative,,Informative,text only (to),other,"Animal, Camel",relevant,,,,Animal,Neutral ,,,"Kutch district, Gujarat, Kharai Camel, Mangroves, Desert"
2019-08-29 , 05:05:15,2019-08-29 05:05:1567055102,RG,https://www.facebook.com/1954072204870360/posts/2425312304413012/,"IIT Delhi Startup Sanfe Launches Reusable, Eco-Friendly Sanitary Napkins",IIT Delhi के students ने केले से बनाया sanitary napkin,Science & Tech,Science & Tech*,,,Technology & Innovations,Education,,,Conservation,Conservation,Informative,,Informative,text only (to),commoner (np),,relevant,,,,Other,Neutral ,,,"IIT Delhi, Sanfe, Sanitary Napkin, Reusable Sanitary Pads, Eco-Friendly Sanitary Pads, Banana Fibers"
2019-08-27 , 13:05:15,2019-08-27 13:05:1566911100,RG,https://www.facebook.com/1954072204870360/posts/2424444344499808/,"Irmim Shamim, Against All Odds, Gains Admission In AIIMS Rajouri",AIIMS Rajouri में admission पाने वाली पहली महिला बनीं Kashmir की बेटी Irmim,Education,Education,,,Education,Achievements,,,"Award/Achievement, Famous Personality","Award/Achievement, Famous Personality",Informative,,"Inspiring, Informative", common voice (optv),commoner (np),,neutral,,,,Commoner,Happy ,,,"Jammu and Kashmir, Irmim Shamim, AIIMS, Rajouri, Medical, MBBS"
2019-08-26 , 13:05:15,2019-08-26 13:05:1566824700,SA,https://www.facebook.com/1954072204870360/posts/2423837454560497/,Remembering Mother Teresa,Kolkata के Mother House में कुछ इस तरह मनाई गई Mother Teresa की 109वीं जयंती,X Do not use People,Lifestyle,,,Lifestyle,People,,,"Social Work, Famous Personality, History","Social Work, Famous Personality, History",Profile,,"Day-specific, Profile", voice of famous personality (fpv),famous personality (fp),,relevant,,,,Famous Personality,Happy ,Mother Teresa,Social,no tags
2019-08-27 , 03:35:15,2019-08-27 03:35:1566876900,DG,https://www.facebook.com/1954072204870360/posts/2423949627882613/,Mumbai's Beloved Ganpati Bappa Has His Highest Throne At LOC,कहां तैयार होती है LOC पर बैठने वाले Ganpati Bappa की प्रतिमा?,Dharohar,Dharohar*,,,Places,Place,,,"Religion, Festival","Religion, Culture",Informative,,Event,text only (to),famous personality (fp),,relevant,,,,Famous Personality,Happy ,Ganapati,Devotional,"Mumbai, Maharashtra, Ganpati, Festival, LOC, India"
2019-09-23 , 02:30:15,2019-09-23 02:30:1569205802,GL,https://www.facebook.com/1954072204870360/posts/2442896082654634/,The Inspiring Story Of Preeti Kumari,मिलिए Western Railway की एकमात्र Motorwoman से,X Do not use People,Lifestyle,,,Government,Achievements,,,"Railways, Famous Personality, Award/Achievement","Person specific, empowerment",Informative,,Informative,text only (to),other,"button, human hand",relevant,,,,Commoner,Happy ,,,"Preeti Kumari, Western Railway, Motorwoman, Indian Railways, Mumbai Local, Train Driver, Commuters"
2019-08-27 , 11:05:15,2019-08-27 11:05:1566903900,DV,https://www.facebook.com/1954072204870360/posts/2424539371156972/,Key Reason Of India's Ongoing Financial Crisis,India के financial crisis के लिए ये 4 reasons बताए जा रहे हैं जिम्मेदार,Business & Money,Economy,,,Government,Economy,,,"Economy/Economic, Crisis","Economy/Economic, Crisis",Explainers,,Explainers,text only (to),Crowd,,relevant,,,,Other,Neutral ,,,"Financial Crisis, Economic Slowdown, Indian Economy, Automobile Sector, Crude Oil"
2019-08-27 , 14:35:15,2019-08-27 14:35:1566916500,HR,https://www.facebook.com/1954072204870360/posts/2424507567826819/,"Kohli Surpasses Ganguly, Joins Dhoni As India's Most Successful Test Captain",सबसे सफल Indian test captain बने Virat Kohli,Sports & Games,Sports & Games,,,Sports & Games,Daily NEWJ*,,,"Cricket, Famous Personality, News","Cricket, Famous Personality, News",Informative,,Informative,text only (to),famous personality (fp),,relevant,,,,Famous Personality,Action,Virat Kohli,Sport,"Cricket, Virat Kohli, Kohli, Indian Cricket Team, West Indies Tour, Dhoni, Ganguly, King Kohli"
2019-08-26 , 11:05:15,2019-08-26 11:05:1566817500,VA,https://www.facebook.com/1954072204870360/posts/2423820864562156/,"The Pride Of India, PV Sindhu Wins The World Badminton Championship",PV Sindhu World Badminton Championship खिताब जीतने वाली बनीं पहली Indian player,Sports & Games,Sports & Games,,,Sports & Games,Achievements,,,"Badminton, Famous Personality, Award/Achievement","Other Sports, Famous Personality, Award/Achievement",Informative,,"Inspiring, Informative",text only (to),famous personality (fp),,relevant,,,,Famous Personality,"Happy, Proud",PV Sindhu,Sport,"Badminton, PV Sindhu, Championship, India"
2019-08-23 , 14:35:15,2019-08-23 14:35:1566570900,DV,https://www.facebook.com/1954072204870360/posts/2421453718132204/,"China, Pakistan Slammed For Human Rights Violation","UN में China और Pakistan हुए शर्मसार, minorities को इन देशों में किया जाता है प्रताड़ित",Foreign Affairs,Foreign Affairs,,,Global News,Crime,,,"Political, Violation","Political, Crime",Shocking/Surprising,,Shocking/Surprising,text only (to),commoner (np),,neutral,,,,Other,Neutral ,,,"Human Rights, China, Pakistan, violation, United Nations"
2019-08-23 , 13:05:15,2019-08-23 13:05:1566565500,DG,https://www.facebook.com/1954072204870360/posts/2421455948131981/,Financial Action Task Force Blacklists Pakistan,Terror funding के खिलाफ कदम नहीं उठाए जाने पर FATF ने Pakistan को किया black list,Foreign Affairs,Foreign Affairs,,,Global News,Economy,,,"Economy/Economic, Violation, Policies/Norms/Rules","Economy/Economic, Crime, Policies/Norms/Rules",Shocking/Surprising,,Shocking/Surprising,text only (to),famous personality (fp),,loud,,,,Famous Personality,Neutral ,Imran Khan,Politics,no tags
2019-08-28 , 11:17:15,2019-08-28 11:17:1566991065,RG,https://www.facebook.com/1954072204870360/posts/2424618717815704/,Public Toilet Becomes Home For A 65-Year-Old In Madurai,मजबूरी में पिछले 19 सालों से public toilet में रह रही हैं 65 साल की Karuppayi,X Do not use People,Lifestyle,,,Lifestyle,Economy,,,"Economy/Economic, Person Specific","Economy/Economic, Person Specific",Emotional,,Emotional,text only (to),other,"floor, object",neutral,,,,Commoner,Sad,,,"Madurai, India, Public Toilet, Karuppayi, Old Woman, Pension, Collector"
2019-09-08 , 11:05:15,2019-09-08 11:05:1567940700,RG,https://www.facebook.com/1954072204870360/posts/2431685710442338/,12-Year Old Mohammed Hasan Develops Smart Dustbin,12 साल के Mohammed Hasan ने बनाया smart dustbin,Animals ,Environment,,,Environment/Ecosystem,Tech,,,"Tech, Conservation","Conservation, Person specific",Informative,,Informative,text only (to),other,dustbin,loud,,,,Object,Neutral ,,,"Telangana, Hyderabad, Smart Dustbin, 12-year Old Boy, Swachh Bharat Abhiyaan"
2019-08-28 , 13:05:15,2019-08-28 13:05:1566997500,DG,https://www.facebook.com/1954072204870360/posts/2425259214418321/,Palak Sidhwani Joins Taarak Mehta Ka Ooltah Chasma as New Sonu,कौन है Taarak Mehta Ka Ooltah Chashma की नई Sonu?,X Do not use Bollywood & Entertainment,Filmy*,,,Entertainment,People,,,"Digital/TV, Famous Personality, News","Digital/TV, Famous Personality, News",Informative,,General ,text only (to),commoner (np),,relevant,,,,Commoner,Happy ,,,"Sonu, Palak Sidhwani, Taarak Mehta, TMKOC, SAB TV, Bhide, Jethalal"
2019-09-14 , 14:35:15,2019-09-14 14:35:1568471700,SA,https://www.facebook.com/1954072204870360/posts/2436538443290398/,Real Names Of Bollywood's Top Celebrities,कुछ इस तरह के हैं आपके favourite celebrities के असल नाम,X Do not use Bollywood & Entertainment,Filmy*,,,Entertainment,Entertainment,,,Bollywood,Bollywood,Informative,,General ,text only (to),famous personality (fp),,relevant,,,,Famous Personality,Happy ,Shilpa Shetty,film,"Bollywood, Real Names, Amitabh Bachchan, Akshay Kumar, Katrina Kaif, Rajnikanth, Shilpa Shetty"
2019-09-01 , 14:35:15,2019-09-01 14:35:1567348500,SA,https://www.facebook.com/1954072204870360/posts/2426763294267913/,Dharmendra Shares His Excitement Over His Grandson Karan Deol's Bollywood Debut,Deol परिवार की तीसरी पीढ़ी में से अब कौन रखने जा रहा है Bollywood में अपने कदम?,X Do not use Bollywood & Entertainment,Filmy*,,,Entertainment,People,,,"Bollywood, Famous Personality, News","Bollywood, Famous Personality, News",Entertaining,,"General, Entertaining ", voice of famous personality (fpv),famous personality (fp),,loud,,,,Famous Personality,Happy ,Sunny Deol,"Politics, film","Bollywood, Karan Deol, Sunny Deol, Dharmendra, Pal Pal Dil Ke Paas"
2019-09-03 , 03:35:15,2019-09-03 03:35:1567481700,DV,https://www.facebook.com/1954072204870360/posts/2425871177690458/,"After Parle, Britannia Hikes Price Of Its Products",क्यों October से बढ़ाने वाला है Britannia biscuits के price?,Business & Money,Business & Money,,,Business,Economy,,,"Budget, Economy/Economic","Economy/Economic, News",Informative,,Informative,text only (to),commoner (np),,loud,,,,Other,Neutral ,,,"Britannia, Parle G, Biscuits, Price Hike, Financial Crisi, Economic Slowdown"
2019-09-02 , 03:35:15,2019-09-02 03:35:1567395300,SN,https://www.facebook.com/1954072204870360/posts/2427398760871033/,Celebrating Ganesh Chaturthi,आज से विराजे गणपति बप्पा,X Do not use History,Dharohar*,,,Lifestyle,Lifestyle,,,"Religion, Festival","Religion, Culture",Explainers,,Explainers,other,famous personality (fp),,no music,,,,Famous Personality,Happy ,Ganapati,Devotional,"Ganesh Chaturthi, Ganpati Bappa, History, Indian Festival, Ganesh festival"
2019-09-02 , 16:05:15,2019-09-02 16:05:1567440301,SA,https://www.facebook.com/1954072204870360/posts/2424543634489879/,"The Top Tier Of Bollywood, And How Much They Get Paid",जानिए एक film के लिए कितना charge करते हैं ये Bollywood जगत के सितारे,X Do not use Bollywood & Entertainment,Filmy*,,,Entertainment,Economy,,,Bollywood,Bollywood,Informative,,Informative,other,famous personality (fp),,loud,,,,Famous Personality,Happy ,Deepika Padukone,film,"Bollywood, Highest Paid Actors, Top Actors, Akshay Kumar, Salman Khan, Kangana Ranaut, Aamir Khan"
2019-08-29 , 14:35:15,2019-08-29 14:35:1567089300,VA,https://www.facebook.com/1954072204870360/posts/2425880737689502/,Viral: Sara Ali Khan Takes Selfies With Her Little Fans At Airport,क्या है Sara Ali Khan की इस खुशी का राज ?,X Do not use Bollywood & Entertainment,Filmy*,,,Entertainment,People,,,"Bollywood, Fans, Famous Personality","Bollywood, Famous Personality",Entertaining,,General ,text only (to),famous personality (fp),,loud,,,,Famous Personality,Happy ,Sara Ali Khan,film,"Sara Ali Khan, Coolie No. 1, Fans, Selfie, Mumbai Airport, Varun Dhawan"
2019-08-28 , 16:05:15,2019-08-28 16:05:1567008300,VA,https://www.facebook.com/1954072204870360/posts/2425269384417304/,Salman Khan Starrer 'Dabangg 3' Will Be Released In 4 Languages,"Chulbul Pandey आएंगे इस बार Hindi, Kannada, Tamil और Telugu में",X Do not use Bollywood & Entertainment,Filmy*,,,Entertainment,Daily NEWJ*,,,"Bollywood, News","Bollywood, News",Informative,,Informative,text only (to),other,"Sun, hand",loud,,,,Famous Personality,Proud,Salman Khan,film,"Kannada, Dabangg 3, Salman Khan, Dabangg, Tamil, Telugu, Bhaijaan, Chulbul Pandey"
2019-09-02 , 11:05:15,2019-09-02 11:05:1567422300,DG,https://www.facebook.com/1954072204870360/posts/2424475647830011/,Device That Can Diagnose The Risk Of Heart Attack Through Smartphones,"IIT Bombay के professors और students ने बनाया ऐसा device, जो heart attack के बारे में पहले दे देगा जानकारी",Science & Tech,Science & Tech*,,,Technology & Innovations,Daily NEWJ*,,,"Medical, Tech",Health,Informative,,Informative,other,other,mobile screen,loud,,,,Object,Neutral ,,,"Heart Attack, IIT Bombay, Smartphone, Cardiac Arrest"
2019-09-02 , 13:05:15,2019-09-02 13:05:1567429500,,https://www.facebook.com/1954072204870360/posts/2426030801007829/,Amethi: Unique Statues Made From Paper And Grass,कभी देखी हैं paper और घास की मूर्तियां?,X Do not use People,Art,,,Skill & Art ,Environment,,,"Creative Skill, Conservation","Visual Arts, Conservation",Informative,,Informative,text only (to),commoner (np),,relevant,,,,Commoner,Neutral ,,,"Paper Statues, Grass Statues, Handicrafts, Amethi, Light Handicraft"
2019-11-08 , 06:35:15,2019-11-08 06:35:1573194900,AK,https://www.facebook.com/1954072204870360/posts/2487129254897983/,Vijay Nishanth - India's Only Tree Doctor,ये हैं पेड़ों के डॉक्टर,X Do not use People,Environment,,,Environment/Ecosystem,Health,,,"Health, Conservation","Health, Conservation",Shocking/Surprising,,Shocking/Surprising,text only (to),commoner (np),,relevant,,,,Commoner,Happy ,,,"Environmental Science, Vijay Nishanth, Tree Doctor, Trees, Greenery, Plants, Plantations, Environment"
2019-08-22 , 10:15:15,2019-08-22 10:15:1566468901,DV,https://www.facebook.com/1954072204870360/posts/2420575011553408/,"Rifles Jammed During The Last Rites Of Former Bihar CM, Not A Single Rifle Was Fired","Bihar Police की खुली पोल, funeral में सलामी के दौरान 22 में से एक भी rifle से गोली नहीं चल पाई",Politics,Politics*,,,Politics,Daily NEWJ*,,,"News, Famous Personality","News, Famous Personality",Informative,,"Event, Informative",text only (to),commoner (np),,relevant,,,,Famous Personality,Happy ,Jagannath Mishra,Politics,"Bihar, Police, funeral, Chief Minister, Rifles"
2019-08-22 , 16:05:15,2019-08-22 16:05:1566489900,AKG,https://www.facebook.com/1954072204870360/posts/2420761828201393/,Mika Singh Apologises To The Nation For His Performance In Pakistan,सवालों से irritate होकर press conference क्यों छोड़ी Mika Singh ने ?,X Do not use Bollywood & Entertainment,Filmy*,,,Entertainment,People,,,"Bollywood, Music, Famous Personality","Bollywood, Music, Famous Personality",Controversial,,Controversial, voice of famous personality (fpv),famous personality (fp),,loud,,,,Famous Personality,Action,Mika Singh,film,"Pakistan, Mika Singh, Performance, Press Conference, Apologise"
2019-08-21 , 11:35:15,2019-08-21 11:35:1566387325,DG,https://www.facebook.com/1954072204870360/posts/2419935688284007/,Olympic hockey Test Event: India Blank New Zealand 5-0 In Final,New Zealand को हरा Indian Men's Hockey Team ने जीता Olympics test event का final,Sports & Games,Sports & Games,,,Sports & Games,Achievements,,,"Hockey, Award/Achievement, News","Hockey, Award/Achievement, News",Informative,,Informative,text only (to),commoner (np),,loud,,,,Commoner,Action,,,"Hockey (sport family), New Zealand, IndianHockeyTeam, Sports, Olympics, Final, Win"
2019-09-15 , 05:05:15,2019-09-15 05:05:1568523900,AKG,https://www.facebook.com/1954072204870360/posts/2437355133208729/,Lucknow Railway Station Gets Lightened Up With New Colours,रौशनी से जगमगाया Lucknow Railway Station,Travel,Travel,,,Places,Place,,,"Railways, Creative Skill",Visual Arts,Informative,,General ,text only (to),other,"railway station, building",no music,,,,Object,Neutral ,,,"Lucknow, Uttar Pradesh, Lucknow, Railway Station, Colours"
2019-08-22 , 13:05:15,2019-08-22 13:05:1566479100,DG,https://www.facebook.com/1954072204870360/posts/2420608471550062/,Use Of Plastic Items In Parliament Brought To A Complete Halt,PM Modi ने कौनसा दिया था देश को संदेश जो सबसे पहले लागू हुआ Parliament में?,Animals ,Environment,,,Environment/Ecosystem,Daily NEWJ*,,,"Political, News, Conservation","Political, News, Conservation",Informative,,General ,other,other,"parlament, building",neutral,,,,Object,Neutral ,,,"PM Modi, Modi, Bhartiya Janata Party, Plastics, Ban, Narendra Modi, Parliament"
2019-08-22 , 14:35:15,2019-08-22 14:35:1566484500,AK,https://www.facebook.com/1954072204870360/posts/2420610781549831/,Ahmedabad Police's Noble Initiative For Children Residing On Footpath,बेघर बच्चों के लिए Ahmedabad Police की ये 'पुलिस की पाठशाला',Education,Police-Army,,,Education,Social Work,,,"Police, Social Work, Educational Institute","Police, Social Work",Inspiring,,"Inspiring, Informative",text only (to),other,banner,relevant,,,,Commoner,Happy ,,,"Gujarat, Police & Military Dogs, Ahemdabad, Footpath, School, Education"
2019-08-31 , 02:05:15,2019-08-31 02:05:1567217131,HG,https://www.facebook.com/1954072204870360/posts/2426783974265845/,Life Lesson: Your Life Doesn't Stop In Anybody's Absence,क्या कहती है महात्मा और सज्जन की ये कहानी?,Education,Lifestyle,,,Lifestyle,Lifestyle,,,Philosophy,Spiritual,Explainers,,Explainers,other,other, commoner animation,relevant,,,,Other,Happy ,,,Life Lessons
2019-10-30 , 04:30:15,2019-10-30 04:30:1572409800,DG,https://www.facebook.com/1954072204870360/posts/2474216049522637/,Pranav Lal - Seeing The World Through The Lenses,"मिलिए प्रणव लाल से, आंखें नहीं होने के बावजूद ये क्लिक करते हैं शानदार तस्वीरें",X Do not use People,Art,,,Skill & Art ,People,,,"Creative Skill, Differently Abled","Visual Arts, Person Specific",Shocking/Surprising,,Shocking/Surprising,text only (to),commoner (np),,relevant,,,,Commoner,Neutral ,,,"Travel Photography, Photography, Pranav Lal, Blind Photographer, Visually Impaired"
2019-08-25 , 11:05:15,2019-08-25 11:05:1566731100,AK,https://www.facebook.com/1954072204870360/posts/2420628468214729/,Gorakhpur Railway Station Has The World's Longest Platform,India की कौनसी city में है दुनिया का सबसे लंबा railway platform?,Travel,Travel,,,Places,Place,,,Railways,Facts,Informative,,Informative,text only (to),other,"railway station, building",relevant,,,,Object,Neutral ,,,"Gorakhpur, Railway, Train, Station, Travel, World Record, City"
2019-08-21 , 11:05:15,2019-08-21 11:05:1566385500,DG,https://www.facebook.com/1954072204870360/posts/2419848791626030/,Man vs Wild Episode With PM Modi World’s Most Trending Televised Event,Man Vs Wild का ये episode बना दुनिया का सबसे ज्यादा देखे जाने वाला episode,X Do not use Bollywood & Entertainment,Politics*,,,Entertainment,People,,,"Digital/TV, Famous Personality, Political","Digital/TV, Famous Personality, Political",Informative,,General ,text only (to),famous personality (fp),,relevant,,,,Famous Personality,"Happy, Action",Narendra Modi,Politics,"Televisions, Wildlife, Narendra Modi, PM Modi, Prime Minister, Bhartiya Janata Party, Adventure, Broadcast"
2019-08-21 , 16:05:15,2019-08-21 16:05:1566403500,DV,https://www.facebook.com/1954072204870360/posts/2419912028286373/,INX Media case: How Chidambaram Got Into Trouble,क्या है INX Media case का पूरा मामला? जिसमें P Chidambaram की anticipatory bail कर दी गई है reject,Crime,Politics*,,,Politics,Daily NEWJ*,,,"News, Famous Personality","News, Famous Personality",Explainers,,Explainers,text only (to),famous personality (fp),,neutral,,,,Famous Personality,Sad,P Chidambaram,Politics,"INX Media, Media, Case, Arrest, Rejection, Chidambaram"
2019-09-20 , 06:35:15,2019-09-20 06:35:1568961300,DV,https://www.facebook.com/1954072204870360/posts/2442910179319891/,Transforming Barren Land To A Sanctuary,ये है भारत की एकमात्र private Wildlife Sanctuary,Animals ,Environment,,,Environment/Ecosystem,Animals,,,Conservation,Conservation,Informative,,"Inspiring, Informative",text only (to),commoner (np),,relevant,,,,Commoner,Happy ,,,"Wildlife Tourism, Sai Sanctuary, Barren Land, Wildlife Conservation, Pamela, Anil Malhotra, Private Wildlife Sanctuary"
2019-09-03 , 05:05:15,2019-09-03 05:05:1567487100,RG,https://www.facebook.com/1954072204870360/posts/2424511614493081/,Creating Beautiful Shelters From Plastic Scrap,किस तरह plastic के कचरे से सुंदर घर बना रहा है ये couple?,Animals ,Environment,,,Environment/Ecosystem,Environment,,,Conservation,Conservation,Informative,,Informative,other,other,plastic trash,neutral,,,,Object,Neutral ,,,"Hyderabad, Waste management, Plastic Waste, Indian Couple, Recycle, Plastic Recycle"
2019-08-21 , 10:15:15,2019-08-21 10:15:1566382504,DG,https://www.facebook.com/1954072204870360/posts/2419784311632478/,Rare Sea Sparkle Seen At Chennai Beach,Chennai beach पर दिखा ये खूबसूरत नजारा,X Do not use Shocking Visuals,Travel,,,Places,Place,,,News,News,Informative,,General ,other,other,sea,relevant,,,,Nature,Neutral ,,,"Beauty, Chennai, India, Beach, Sparkle, Unique"
2019-08-21 , 13:05:15,2019-08-21 13:05:1566392701,AK,https://www.facebook.com/1954072204870360/posts/2419950401615869/,Chennai's Water Crisis at It's Peak,देखिए बूंद-बूंद पानी के लिए कैसे तरस रहे हैं Chennai के लोग,Animals ,Environment,,,Environment/Ecosystem,Environment,,,Crisis,Crisis,Informative,,"Shocking/Surprising, Informative",text only (to),other,dry land,relevant,,,,Crowd,Neutral ,,,"Chennai, India, Environmental Policy, Water Crisis, Water, Nature, Economy, Resources, Ground water"
2019-08-21 , 14:35:15,2019-08-21 14:35:1566398100,DG,https://www.facebook.com/1954072204870360/posts/2419978298279746/,This Primary School In Lucknow is Devoid of Basic Amenities,कहां है ये school जहां बच्चों के लिए नहीं है बिजली और पानी?,Education,Education,,,Education,Education,,,Facilities,Crisis,Informative,,Informative,text only (to),other,school,relevant,,,,Crowd,Neutral ,,,"Lucknow, Uttar Pradesh, Government, School, Education, Students, Amenities, Primary School"
2019-08-25 , 03:35:15,2019-08-25 03:35:1566704100,HR,https://www.facebook.com/1954072204870360/posts/2420560078221568/,"Cochin International Airport, The 1st Fully Solar-Powered Airport",India का ये airport है world का 1st fully solar powered airport,Travel,Travel,,,Technology & Innovations,Place,,,"Tech, Conservation",Conservation,Informative,,Informative,text only (to),other,solar panel,relevant,,,,Object,Neutral ,,,"Cochin, Kerala, Airport, Solar Power, Technology, Growth, Develop"
2019-08-22 , 11:35:15,2019-08-22 11:35:1566473700,DV,https://www.facebook.com/1954072204870360/posts/2420606024883640/,Daring IAF Jawans Rescue 2 Men Stranded In Tawi River,किस तरह IAF के जवानों ने बचाई Tawi नदी के पास फंसे इन 2 लोगों की जान?,X Do not use Armed Forces,Police-Army,,,Forces,Daily NEWJ*,,,"Air Force, News","Air Force, News",Informative,,General ,text only (to),commoner (np),,relevant,,,,Object,Neutral ,,,"Indian Air Force, Garud Commando, Jawan, Stranded, Soldiers, Army"
2019-09-01 , 05:05:15,2019-09-01 05:05:1567314300,VA,https://www.facebook.com/1954072204870360/posts/2425298977747678/,Off-Road Racers' First Choice - Maruti Suzuki Gypsy,Maruti Suzuki Gypsy की history और नया अवतार,X Do not use History,Sports & Games,,,Sports & Games,Undefined,,,MotorSports,Other Sports,Informative,,Informative,text only (to),other,Maruti suzuki gypsy,relevant,,,,Object,Neutral ,,,"Gypsy, Maruti Suzuki, Off-Road, Gypsy Racing, Maruti, Suzuki"
